{"$id":"https://harness.planeon.ai/schemas/v1alpha1/runtime/budget-consumption.schema.json","$schema":"https://json-schema.org/draft/2020-12/schema","additionalProperties":false,"properties":{"apiVersion":{"$ref":"common.schema.json#/$defs/apiVersion"},"kind":{"const":"BudgetConsumption"},"metadata":{"$ref":"common.schema.json#/$defs/metadata"},"spec":{"additionalProperties":false,"allOf":[{"else":{"properties":{"exceededDimensions":{"minItems":1}}},"if":{"properties":{"decision":{"const":"WITHIN_BUDGET"}},"required":["decision"]},"then":{"properties":{"exceededDimensions":{"maxItems":0}}}}],"properties":{"admissionDigest":{"$ref":"common.schema.json#/$defs/sha256"},"budgetDigest":{"$ref":"common.schema.json#/$defs/sha256"},"decision":{"enum":["WITHIN_BUDGET","OVER_BUDGET"]},"exceededDimensions":{"items":{"enum":["CONCURRENT_TASKS","TASK_SECONDS","RETRIES","TOOL_CALLS","MODEL_TOKENS"]},"type":"array","uniqueItems":true},"limits":{"$ref":"common.schema.json#/$defs/budgetLimits"},"observed":{"$ref":"common.schema.json#/$defs/budgetObserved"},"organizationId":{"$ref":"common.schema.json#/$defs/stableId"},"recordedAt":{"$ref":"common.schema.json#/$defs/timestamp"}},"required":["organizationId","budgetDigest","admissionDigest","limits","observed","decision","exceededDimensions","recordedAt"],"type":"object"}},"required":["apiVersion","kind","metadata","spec"],"title":"BudgetConsumption","type":"object"}
