{"apiVersion":"harness.planeon.ai/v1alpha1","kind":"BudgetConsumption","metadata":{"id":"runtime.budget-consumption-001","version":"1.0.0"},"spec":{"admissionDigest":"sha256:7777777777777777777777777777777777777777777777777777777777777777","budgetDigest":"sha256:4444444444444444444444444444444444444444444444444444444444444444","decision":"WITHIN_BUDGET","exceededDimensions":[],"limits":{"maxConcurrentTasks":4,"maxModelTokens":4096,"maxRetries":2,"maxTaskSeconds":300,"maxToolCalls":20},"observed":{"concurrentTasks":4,"modelTokens":4096,"retries":2,"taskSeconds":300,"toolCalls":20},"organizationId":"acme.example","recordedAt":"2030-02-01T00:00:01Z"}}
